### ISSUE TITLE
Fortigate  - Relp error: Relp::InvalidCommand 0

### ISSUE THREAD

**Issue by jorgeag2000** [logstash-plugins/logstash-input-relp#14]
Hi, i have this error while logging Fortigate Logs via TCP protocol , researching i found that Fortigate uses RFC3195 so we require relp input in order to receive fortigate logs via tcp but i have the following error on the logstash server

{:timestamp=>"2016-05-11T14:55:52.439000-0500", :message=>"Relp error: Relp::InvalidCommand 0", :level=>:warn}
{:timestamp=>"2016-05-11T14:55:53.300000-0500", :message=>"Relp error: Relp::InvalidCommand 0", :level=>:warn}
{:timestamp=>"2016-05-11T14:55:56.113000-0500", :message=>"Relp error: Relp::InvalidCommand 0", :level=>:warn}
{:timestamp=>"2016-05-11T14:55:56.267000-0500", :message=>"Relp error: Relp::InvalidCommand 0", :level=>:warn}
{:timestamp=>"2016-05-11T14:55:58.260000-0500", :message=>"Relp error: Relp::InvalidCommand 0", :level=>:warn}
{:timestamp=>"2016-05-11T14:56:01.638000-0500", :message=>"Relp error: Relp::InvalidCommand 0", :level=>:warn}
{:timestamp=>"2016-05-11T14:56:03.407000-0500", :message=>"Relp error: Relp::InvalidCommand 0", :level=>:warn}
{:timestamp=>"2016-05-11T14:56:05.201000-0500", :message=>"Relp error: Relp::InvalidCommand 0", :level=>:warn}
{:timestamp=>"2016-05-11T14:56:06.176000-0500", :message=>"Relp error: Relp::InvalidCommand 0", :level=>:warn}
{:timestamp=>"2016-05-11T14:56:08.193000-0500", :message=>"Relp error: Relp::InvalidCommand 0", :level=>:warn}
{:timestamp=>"2016-05-11T14:56:11.366000-0500", :message=>"Relp error: Relp::InvalidCommand 0", :level=>:warn}
{:timestamp=>"2016-05-11T14:56:12.381000-0500", :message=>"Relp error: Relp::InvalidCommand 0", :level=>:warn}
{:timestamp=>"2016-05-11T14:56:13.339000-0500", :message=>"Relp error: Relp::InvalidCommand 0", :level=>:warn}

- Version: Logstash 2.2.4
- Operating System: Ubuntu Server 14.04
- Config File (if you have sensitive info, please remove it):

input {
  relp {
    port => 2000
  }
}

- Sample Data:

tcpdump: listening on eth0, link-type EN10MB (Ethernet), capture size 65535 bytes
14:51:06.092769 IP (tos 0x0, ttl 63, id 17956, offset 0, flags [DF], proto TCP (6), length 60)
    SourceFGT_IP.23669 > DestinationLogstashServer: Flags [S], cksum 0x650a (correct), seq 2570809317, win 5592, options [mss 1356,sackOK,TS val 3240706532 ecr 0,nop,wscale 1], length 0
14:51:06.092823 IP (tos 0x0, ttl 64, id 0, offset 0, flags [DF], proto TCP (6), length 60)
    DestinationLogstashServer > SourceFGT_IP.23669: Flags [S.], cksum 0x5d46 (incorrect -> 0x574d), seq 4228563935, ack 2570809318, win 28960, options [mss 1460,sackOK,TS val 2421222 ecr 3240706532,nop,wscale 7], length 0
14:51:06.162898 IP (tos 0x0, ttl 63, id 17957, offset 0, flags [DF], proto TCP (6), length 52)
    SourceFGT_IP.23669 > DestinationLogstashServer: Flags [.], cksum 0xec46 (correct), seq 1, ack 1, win 2796, options [nop,nop,TS val 3240706539 ecr 2421222], length 0
14:51:06.162900 IP (tos 0x0, ttl 63, id 17958, offset 0, flags [DF], proto TCP (6), length 125)
    SourceFGT_IP.23669 > DestinationLogstashServer: Flags [P.], cksum 0xf1b3 (correct), seq 1:74, ack 1, win 2796, options [nop,nop,TS val 3240706539 ecr 2421222], length 73
14:51:06.162961 IP (tos 0x0, ttl 64, id 12823, offset 0, flags [DF], proto TCP (6), length 52)
    DestinationLogstashServer > SourceFGT_IP.23669: Flags [.], cksum 0x5d3e (incorrect -> 0xf5f5), seq 1, ack 74, win 227, options [nop,nop,TS val 2421239 ecr 3240706539], length 0
14:51:06.163694 IP (tos 0x0, ttl 64, id 12824, offset 0, flags [DF], proto TCP (6), length 67)
    DestinationLogstashServer > SourceFGT_IP.23669: Flags [P.], cksum 0x5d4d (incorrect -> 0x126f), seq 1:16, ack 74, win 227, options [nop,nop,TS val 2421240 ecr 3240706539], length 15
14:51:06.163738 IP (tos 0x0, ttl 64, id 12825, offset 0, flags [DF], proto TCP (6), length 53)
    DestinationLogstashServer > SourceFGT_IP.23669: Flags [FP.], cksum 0x5d3f (incorrect -> 0xebdb), seq 16:17, ack 74, win 227, options [nop,nop,TS val 2421240 ecr 3240706539], length 1
14:51:06.233919 IP (tos 0x0, ttl 63, id 17959, offset 0, flags [DF], proto TCP (6), length 52)
    SourceFGT_IP.23669 > DestinationLogstashServer: Flags [.], cksum 0xebd5 (correct), seq 74, ack 16, win 2796, options [nop,nop,TS val 3240706546 ecr 2421240], length 0
14:51:06.233920 IP (tos 0x0, ttl 63, id 17960, offset 0, flags [DF], proto TCP (6), length 52)
    SourceFGT_IP.23669 > DestinationLogstashServer: Flags [.], cksum 0xebd3 (correct), seq 74, ack 18, win 2796, options [nop,nop,TS val 3240706546 ecr 2421240], length 0
14:51:06.233922 IP (tos 0x0, ttl 63, id 17961, offset 0, flags [DF], proto TCP (6), length 52)
    SourceFGT_IP.23669 > DestinationLogstashServer: Flags [F.], cksum 0xebd2 (correct), seq 74, ack 18, win 2796, options [nop,nop,TS val 3240706546 ecr 2421240], length 0
14:51:06.233977 IP (tos 0x0, ttl 64, id 62889, offset 0, flags [DF], proto TCP (6), length 52)
    DestinationLogstashServer > SourceFGT_IP.23669: Flags [.], cksum 0xf5ca (correct), seq 18, ack 75, win 227, options [nop,nop,TS val 2421257 ecr 3240706546], length 0
14:51:06.554730 IP (tos 0x0, ttl 63, id 16294, offset 0, flags [DF], proto TCP (6), length 60)
    SourceFGT_IP.23670 > DestinationLogstashServer: Flags [S], cksum 0x7d4a (correct), seq 3662288487, win 5592, options [mss 1356,sackOK,TS val 3240706578 ecr 0,nop,wscale 1], length 0
14:51:06.554753 IP (tos 0x0, ttl 64, id 0, offset 0, flags [DF], proto TCP (6), length 60)
    DestinationLogstashServer > SourceFGT_IP.23670: Flags [S.], cksum 0x5d46 (incorrect -> 0x08cb), seq 1519635366, ack 3662288488, win 28960, options [mss 1460,sackOK,TS val 2421337 ecr 3240706578,nop,wscale 7], length 0
14:51:06.624085 IP (tos 0x0, ttl 63, id 16295, offset 0, flags [DF], proto TCP (6), length 52)
    SourceFGT_IP.23670 > DestinationLogstashServer: Flags [.], cksum 0x9dc4 (correct), seq 1, ack 1, win 2796, options [nop,nop,TS val 3240706585 ecr 2421337], length 0
14:51:06.624087 IP (tos 0x0, ttl 63, id 16296, offset 0, flags [DF], proto TCP (6), length 125)
    SourceFGT_IP.23670 > DestinationLogstashServer: Flags [P.], cksum 0xa331 (correct), seq 1:74, ack 1, win 2796, options [nop,nop,TS val 3240706585 ecr 2421337], length 73
14:51:06.624138 IP (tos 0x0, ttl 64, id 14796, offset 0, flags [DF], proto TCP (6), length 52)
    DestinationLogstashServer > SourceFGT_IP.23670: Flags [.], cksum 0x5d3e (incorrect -> 0xa772), seq 1, ack 74, win 227, options [nop,nop,TS val 2421355 ecr 3240706585], length 0
14:51:06.624763 IP (tos 0x0, ttl 64, id 14797, offset 0, flags [DF], proto TCP (6), length 67)
    DestinationLogstashServer > SourceFGT_IP.23670: Flags [P.], cksum 0x5d4d (incorrect -> 0xc3ec), seq 1:16, ack 74, win 227, options [nop,nop,TS val 2421355 ecr 3240706585], length 15
14:51:06.624791 IP (tos 0x0, ttl 64, id 14798, offset 0, flags [DF], proto TCP (6), length 53)
    DestinationLogstashServer > SourceFGT_IP.23670: Flags [FP.], cksum 0x5d3f (incorrect -> 0x9d59), seq 16:17, ack 74, win 227, options [nop,nop,TS val 2421355 ecr 3240706585], length 1
14:51:06.695658 IP (tos 0x0, ttl 63, id 16297, offset 0, flags [DF], proto TCP (6), length 52)
    SourceFGT_IP.23670 > DestinationLogstashServer: Flags [.], cksum 0x9d53 (correct), seq 74, ack 16, win 2796, options [nop,nop,TS val 3240706592 ecr 2421355], length 0
14:51:06.695659 IP (tos 0x0, ttl 63, id 16298, offset 0, flags [DF], proto TCP (6), length 52)
    SourceFGT_IP.23670 > DestinationLogstashServer: Flags [.], cksum 0x9d51 (correct), seq 74, ack 18, win 2796, options [nop,nop,TS val 3240706592 ecr 2421355], length 0
14:51:06.695661 IP (tos 0x0, ttl 63, id 16299, offset 0, flags [DF], proto TCP (6), length 52)
    SourceFGT_IP.23670 > DestinationLogstashServer: Flags [F.], cksum 0x9d50 (correct), seq 74, ack 18, win 2796, options [nop,nop,TS val 3240706592 ecr 2421355], length 0
14:51:06.695706 IP (tos 0x0, ttl 64, id 62914, offset 0, flags [DF], proto TCP (6), length 52)
    DestinationLogstashServer > SourceFGT_IP.23670: Flags [.], cksum 0xa747 (correct), seq 18, ack 75, win 227, options [nop,nop,TS val 2421373 ecr 3240706592], length 0
14:51:08.104065 IP (tos 0x0, ttl 63, id 46836, offset 0, flags [DF], proto TCP (6), length 60)
    SourceFGT_IP.23671 > DestinationLogstashServer: Flags [S], cksum 0xec87 (correct), seq 3785531189, win 5592, options [mss 1356,sackOK,TS val 3240706733 ecr 0,nop,wscale 1], length 0
14:51:08.104108 IP (tos 0x0, ttl 64, id 0, offset 0, flags [DF], proto TCP (6), length 60)
    DestinationLogstashServer > SourceFGT_IP.23671: Flags [S.], cksum 0x5d46 (incorrect -> 0x728f), seq 1677772334, ack 3785531190, win 28960, options [mss 1460,sackOK,TS val 2421725 ecr 3240706733,nop,wscale 7], length 0
14:51:08.173357 IP (tos 0x0, ttl 63, id 46837, offset 0, flags [DF], proto TCP (6), length 52)
    SourceFGT_IP.23671 > DestinationLogstashServer: Flags [.], cksum 0x0789 (correct), seq 1, ack 1, win 2796, options [nop,nop,TS val 3240706740 ecr 2421725], length 0
14:51:08.173358 IP (tos 0x0, ttl 63, id 46838, offset 0, flags [DF], proto TCP (6), length 125)
    SourceFGT_IP.23671 > DestinationLogstashServer: Flags [P.], cksum 0x0cf6 (correct), seq 1:74, ack 1, win 2796, options [nop,nop,TS val 3240706740 ecr 2421725], length 73
14:51:08.173402 IP (tos 0x0, ttl 64, id 13761, offset 0, flags [DF], proto TCP (6), length 52)
    DestinationLogstashServer > SourceFGT_IP.23671: Flags [.], cksum 0x5d3e (incorrect -> 0x1138), seq 1, ack 74, win 227, options [nop,nop,TS val 2421742 ecr 3240706740], length 0
14:51:08.174055 IP (tos 0x0, ttl 64, id 13762, offset 0, flags [DF], proto TCP (6), length 67)
    DestinationLogstashServer > SourceFGT_IP.23671: Flags [P.], cksum 0x5d4d (incorrect -> 0x2db2), seq 1:16, ack 74, win 227, options [nop,nop,TS val 2421742 ecr 3240706740], length 15
14:51:08.174102 IP (tos 0x0, ttl 64, id 13763, offset 0, flags [DF], proto TCP (6), length 53)
    DestinationLogstashServer > SourceFGT_IP.23671: Flags [FP.], cksum 0x5d3f (incorrect -> 0x071f), seq 16:17, ack 74, win 227, options [nop,nop,TS val 2421742 ecr 3240706740], length 1
14:51:08.243147 IP (tos 0x0, ttl 63, id 46839, offset 0, flags [DF], proto TCP (6), length 52)
    SourceFGT_IP.23671 > DestinationLogstashServer: Flags [.], cksum 0x0719 (correct), seq 74, ack 16, win 2796, options [nop,nop,TS val 3240706747 ecr 2421742], length 0
14:51:08.243148 IP (tos 0x0, ttl 63, id 46840, offset 0, flags [DF], proto TCP (6), length 52)
    SourceFGT_IP.23671 > DestinationLogstashServer: Flags [F.], cksum 0x0718 (correct), seq 74, ack 16, win 2796, options [nop,nop,TS val 3240706747 ecr 2421742], length 0
14:51:08.243169 IP (tos 0x0, ttl 64, id 13764, offset 0, flags [DF], proto TCP (6), length 52)
    DestinationLogstashServer > SourceFGT_IP.23671: Flags [.], cksum 0x5d3e (incorrect -> 0x110e), seq 18, ack 75, win 227, options [nop,nop,TS val 2421759 ecr 3240706747], length 0
14:51:08.243149 IP (tos 0x0, ttl 63, id 43640, offset 0, flags [none], proto TCP (6), length 40)
    SourceFGT_IP.23671 > DestinationLogstashServer: Flags [R], cksum 0x6d5f (correct), seq 3785531263, win 0, length 0
14:51:08.312581 IP (tos 0x0, ttl 63, id 43641, offset 0, flags [none], proto TCP (6), length 40)
    SourceFGT_IP.23671 > DestinationLogstashServer: Flags [R], cksum 0x6d5e (correct), seq 3785531264, win 0, length 0
14:51:09.128768 IP (tos 0x0, ttl 63, id 42717, offset 0, flags [DF], proto TCP (6), length 60)
    SourceFGT_IP.23672 > DestinationLogstashServer: Flags [S], cksum 0xb00b (correct), seq 768708380, win 5592, options [mss 1356,sackOK,TS val 3240706835 ecr 0,nop,wscale 1], length 0
14:51:09.128812 IP (tos 0x0, ttl 64, id 0, offset 0, flags [DF], proto TCP (6), length 60)
    DestinationLogstashServer > SourceFGT_IP.23672: Flags [S.], cksum 0x5d46 (incorrect -> 0xb5c4), seq 3808347774, ack 768708381, win 28960, options [mss 1460,sackOK,TS val 2421981 ecr 3240706835,nop,wscale 7], length 0
14:51:09.198062 IP (tos 0x0, ttl 63, id 42718, offset 0, flags [DF], proto TCP (6), length 52)
    SourceFGT_IP.23672 > DestinationLogstashServer: Flags [.], cksum 0x4abe (correct), seq 1, ack 1, win 2796, options [nop,nop,TS val 3240706842 ecr 2421981], length 0
14:51:09.198063 IP (tos 0x0, ttl 63, id 42719, offset 0, flags [DF], proto TCP (6), length 125)
    SourceFGT_IP.23672 > DestinationLogstashServer: Flags [P.], cksum 0x502b (correct), seq 1:74, ack 1, win 2796, options [nop,nop,TS val 3240706842 ecr 2421981], length 73
14:51:09.198114 IP (tos 0x0, ttl 64, id 12945, offset 0, flags [DF], proto TCP (6), length 52)
    DestinationLogstashServer > SourceFGT_IP.23672: Flags [.], cksum 0x5d3e (incorrect -> 0x546d), seq 1, ack 74, win 227, options [nop,nop,TS val 2421998 ecr 3240706842], length 0
14:51:09.198795 IP (tos 0x0, ttl 64, id 12946, offset 0, flags [DF], proto TCP (6), length 67)
    DestinationLogstashServer > SourceFGT_IP.23672: Flags [P.], cksum 0x5d4d (incorrect -> 0x70e7), seq 1:16, ack 74, win 227, options [nop,nop,TS val 2421998 ecr 3240706842], length 15
14:51:09.198827 IP (tos 0x0, ttl 64, id 12947, offset 0, flags [DF], proto TCP (6), length 53)
    DestinationLogstashServer > SourceFGT_IP.23672: Flags [FP.], cksum 0x5d3f (incorrect -> 0x4a54), seq 16:17, ack 74, win 227, options [nop,nop,TS val 2421998 ecr 3240706842], length 1
14:51:09.269311 IP (tos 0x0, ttl 63, id 42720, offset 0, flags [DF], proto TCP (6), length 52)
    SourceFGT_IP.23672 > DestinationLogstashServer: Flags [.], cksum 0x4a4e (correct), seq 74, ack 16, win 2796, options [nop,nop,TS val 3240706849 ecr 2421998], length 0
14:51:09.269312 IP (tos 0x0, ttl 63, id 42721, offset 0, flags [DF], proto TCP (6), length 52)
    SourceFGT_IP.23672 > DestinationLogstashServer: Flags [.], cksum 0x4a4c (correct), seq 74, ack 18, win 2796, options [nop,nop,TS val 3240706849 ecr 2421998], length 0
14:51:09.269314 IP (tos 0x0, ttl 63, id 42722, offset 0, flags [DF], proto TCP (6), length 52)
    SourceFGT_IP.23672 > DestinationLogstashServer: Flags [F.], cksum 0x4a4b (correct), seq 74, ack 18, win 2796, options [nop,nop,TS val 3240706849 ecr 2421998], length 0
14:51:09.269354 IP (tos 0x0, ttl 64, id 63216, offset 0, flags [DF], proto TCP (6), length 52)
    DestinationLogstashServer > SourceFGT_IP.23672: Flags [.], cksum 0x5442 (correct), seq 18, ack 75, win 227, options [nop,nop,TS val 2422016 ecr 3240706849], length 0

- Steps to Reproduce:

FortiOS: v5.2.3

Configure Fortigate with the next configuration 
config log syslogd setting
   set status enable
   set server "DestinationLogstashServer"
   set reliable enable
   set port 2000
   set csv enable
   set facility local0
   set source-ip SourceFGT_IP
end

**Comment by wiibaa** [comment]
I'm sorry but RFC3195 and RELP are simply different. that's why you cannot ingest your data with this specific output. I would suggest to raise a feature request for RFC3195 support in the syslog input taht currently only support RFC3194.

**Comment by untergeek** [comment]
Thanks, @wiibaa 

Accordingly, this is a different feature request, and not an actual issue with RELP.  Closing.

**Comment by jorgeag2000** [comment]
Thank you for the quick reply, it has been truly helpful .
